[
 {
  "source_file": "glm-provider__01_a.md",
  "extracted_by_model": "x-test-1",
  "name": null,
  "title": "Microsoft 365 Consultant",
  "credentials": [
   "Microsoft 365 Certified: Messaging Administrator Associate",
   "Microsoft 365 Certified: Teams Administrator Associate",
   "Member, Singapore Computer Society"
  ],
  "years_experience": 7,
  "about_headline": "Microsoft 365 tenant builds, mail platform migrations and identity hardening for Singapore clinics, schools and SMEs",
  "about_bio": "I have spent 7 years building and fixing Microsoft 365 environments for small and mid-sized Singapore organisations. My earlier roles were in a Singapore-based medical group's IT department, a Singapore-based managed services provider's cloud team, and a private education group's technology office. I hold a bachelor's degree in information systems from a local autonomous university. Since going independent, my work has centred on clinic groups, training providers and trade associations: consolidating ageing mail servers into clean tenants, and tightening sign-in controls under PDPA.",
  "services": [
   {
    "service_title": "Microsoft 365 Tenant Build and Mail Migration",
    "service_detail": "For small and mid-sized Singapore businesses still running mail on ageing on-premises servers or a single shared hosting account. Services include tenant provisioning and domain verification, mailbox, calendar and contact migration, shared mailbox and distribution group setup, DNS record changes with a rollback window, and an admin handover pack. Includes PDPA-aligned admin role separation. Engagements typically run three to six weeks."
   },
   {
    "service_title": "MFA Rollout and Admin Access Hardening",
    "service_detail": "For Singapore SMEs that need sign-in controls tightened before a client audit or a PDPA review. Services include conditional access policy design and deployment, privileged role separation, legacy authentication lockdown, staff MFA enrolment sessions, and a short baseline document for internal admins. I do not carry out penetration testing or broader cybersecurity reviews."
   }
  ],
  "achievements": [
   "Migrated 14 mailboxes for a three-clinic dental group over a single weekend, completing DNS cutovers with no lost messages.",
   "Consolidated 41 on-premises Exchange mailboxes into one tenant for a tuition centre chain within five weeks.",
   "Configured conditional access and separated admin roles for 26 accounts at a trade association, clearing all findings from an external PDPA gap review.",
   "Built a shared mailbox and distribution list structure for an 18-person civil engineering practice, replacing four informal group inboxes.",
   "Ran a phased MFA enrolment for 60 staff at a family-owned F&B chain, reaching full coverage in nine working days."
  ],
  "technical_proficiency": [
   {
    "category": "Platforms",
    "skills": [
     "Microsoft 365",
     "Exchange Online",
     "Entra ID",
     "SharePoint Online",
     "Microsoft Teams"
    ]
   },
   {
    "category": "Migration tooling",
    "skills": [
     "Exchange hybrid configuration",
     "IMAP and cutover migrations",
     "PowerShell",
     "Entra Connect"
    ]
   },
   {
    "category": "Identity and compliance",
    "skills": [
     "Conditional Access",
     "Multi-factor authentication",
     "Privileged Identity Management",
     "PDPA"
    ]
   }
  ],
  "how_i_work": "I start every engagement with an inventory and a written migration plan that the business signs off. Work happens in small batches: a pilot group first, then the rest cut over outside office hours. I document admin steps as I go, so internal staff can run routine tasks themselves once I leave.",
  "availability": null,
  "rate": null
 },
 {
  "source_file": "glm-provider__01_b.md",
  "extracted_by_model": "x-test-1",
  "name": null,
  "title": "Microsoft 365 Deployment Engineer",
  "credentials": [
   "Microsoft 365 Certified: Messaging Administrator Associate",
   "Microsoft 365 Certified: Teams Administrator Associate"
  ],
  "years_experience": 6,
  "about_headline": "Microsoft 365 tenant setup, email migration and identity hardening for Singapore SMEs",
  "about_bio": "I am a Microsoft 365 engineer with 6 years of experience moving Singapore small and mid-sized businesses onto managed email and identity platforms. I started in a Singapore-based retail group's IT department, moved to a Singapore-based IT services firm's cloud productivity team, and later worked in a healthcare group's IT infrastructure team. I hold an information systems degree from a Singapore university. Now independent, I build tenants, migrate mail and harden accounts for SME clients myself.",
  "services": [
   {
    "service_title": "Microsoft 365 Tenant Setup for SMEs",
    "service_detail": "For small and mid-sized Singapore businesses setting up company email and identity for the first time or moving off informal setups. Services include tenant provisioning and domain verification, licensed mailbox, shared mailbox and distribution list configuration, security group and admin role separation, MFA enforcement across all accounts, and setup documentation, with configurations aligned to the Personal Data Protection Act (PDPA)."
   },
   {
    "service_title": "Email Migration and DNS Cutover",
    "service_detail": "For Singapore businesses moving staff off consumer-grade or legacy hosted mail onto a company-managed platform. Services include a pre-migration inventory of mailboxes and data volumes, staged migration of mail, calendar and contact data, DNS record cutover with MX and SPF changes, post-migration checks on desktop and mobile clients, and a concise handover document. I schedule the cutover outside trading hours."
   }
  ],
  "achievements": [
   "Built and handed over a Microsoft 365 tenant for a 22-staff F&B chain, with 24 mailboxes and 4 shared mailboxes live in under two weeks.",
   "Migrated 18 users from a legacy hosted provider to a new tenant for a construction SME across three weekends with no lost mail.",
   "Configured MFA on all 35 staff accounts at a tuition centre group and split administrator duties across three role groups before a PDPA review.",
   "Cut DNS cutover downtime to under 90 minutes for a wholesale distributor's 26 mailboxes, verified the same afternoon."
  ],
  "technical_proficiency": [
   {
    "category": "Microsoft 365",
    "skills": [
     "Exchange Online",
     "Microsoft Entra ID",
     "SharePoint Online",
     "Microsoft Teams",
     "OneDrive"
    ]
   },
   {
    "category": "Migration and identity",
    "skills": [
     "IMAP and staged migration",
     "DNS record cutover",
     "SPF, DKIM and DMARC",
     "Microsoft Entra Conditional Access",
     "role-based access control"
    ]
   }
  ],
  "how_i_work": "I begin with a short inventory of mailboxes, data volumes and devices, then build the tenant and test with a small pilot group. I migrate in batches outside working hours, verify mail flow and access before switching DNS, and close with a plain-language handover so your own staff can run things.",
  "availability": null,
  "rate": null
 },
 {
  "source_file": "glm-provider__01_d.md",
  "extracted_by_model": "x-test-1",
  "name": null,
  "title": "Data Protection Practitioner",
  "credentials": [
   "Certified Information Privacy Professional/Asia (CIPP/A) (IAPP)",
   "Certified Information Privacy Manager (CIPM) (IAPP)"
  ],
  "years_experience": 7,
  "about_headline": "Hands-on data protection work for Singapore clinics and SMEs: policies, registers, breach readiness and PDPA compliance.",
  "about_bio": "I have spent 7 years in data protection work, starting in a Singapore-based hospital group's compliance office, moving to a privacy consultancy's SME practice, and now working independently as a data protection practitioner for clinics and small businesses across Singapore. I hold a bachelor's degree in information systems from a local university. My work is hands-on: I draft the policies, build the data inventories and set up the registers that keep clients compliant with the PDPA.",
  "services": [
   {
    "service_title": "Outsourced Data Protection Officer Retainer",
    "service_detail": "For small and mid-sized Singapore businesses, particularly medical and dental clinics, that must appoint a data protection officer but do not need one full time. Services include drafting data protection policies and consent wording, building a data inventory across patient and staff records, running breach assessments and PDPC notifications, and delivering staff briefings. Retainer covers ongoing compliance tasks; one-off system changes are quoted separately."
   },
   {
    "service_title": "PDPA Gap Review and Remediation",
    "service_detail": "For small and mid-sized Singapore businesses facing a tender requirement, investor due diligence or a PDPC query that calls for documented compliance. Services include a gap review against PDPC advisory guidelines, drafting remediation policies and staff procedures, reworking collection notices and consent flows, implementing retention and disposal schedules, and preparing a close-out report for management. Covers documentation and process work only; no technical testing."
   }
  ],
  "achievements": [
   "Drafted and rolled out a complete policy set for an eight-clinic dental group, closing 42 register gaps in six weeks.",
   "Built a data inventory covering 35 systems for a four-outlet physiotherapy chain and cut its breach response steps from 11 to 4.",
   "Ran the analysis for a tuition centre's misplaced paper records incident and had the PDPC notification ready within 48 hours.",
   "Implemented retention and disposal schedules across 3,000 patient files for a home-care nursing startup ahead of an investor review.",
   "Prepared and delivered PDPA briefings to 120 frontline staff across three aesthetic clinics in one quarter."
  ],
  "technical_proficiency": [
   {